id,document
aj_1,pope renews call for gaza ceasefire release of captive in easter address Pope Francis say his thought go to those face war especially child who have forget how to smile pope francis have renew call for an immediate ceasefire in gaza and the release of all israeli captive in a peacefocuse address mark easter sunday the most important day on the christian calendar
aj_2,biden be still the good us president israel could wish for the meaningless ceasefire resolution his administration allow the UN Security Council to pass should not fool anyone united states president ronald reagan order to israeli prime minister menachem begin to put an end to his holocaust in lebanon be perhaps the bestknown political anecdote from israel invasion
aj_3,israeli air strike continue across gaza as truce talk struggle israeli strike continue to kill Palestinians as PM Netanyahu face pressure from all side over ceasefire proposal the israeli military have launch more air strike across the gaza strip to deadly effect as official discuss the late propose deal to end hostility and exchange prisoner
aj_4,police remove propalestinian student from pariss sciences po university Students stage sitin and hunger strike at the french university leave campus without incident french police officer enter the paris institute of political study sciences po in paris and remove propalestinian student activist who have occupy its building to protest israel war on gaza
aj_5,mass grave find at southern gaza hospital raid by israeli force search team in Gaza say they ve uncover hundred of body in the ground of Nasser Medical Complex in the city of Khan Younis the hospital be raid by israeli force before their recent withdrawal from the area
aj_6,israel war on gaza list of key event day United Nations chief say Israels military campaign in Gaza have bring relentless death and destruction here how thing stand on saturday april
aj_7,relative of gaza captive protest in cage Relatives of Gaza captive lock themselves in cage and block road in Tel Aviv call on israeli Prime Minister Benjamin Netanyahu to reach a deal to release their love one
aj_8,icj rule israel must stop rafah operation what be next the International Court of Justice have issue a legally binding order for Israel to halt its invasion of Rafah the international court of justice call on israel to end its operation in rafah the southernmost town in gaza
aj_9,israel in gaza palestinian fighter in israel what the un accuse they of Commission of Inquiry accuse Israel and palestinian group of war crime Heres a breakdown a united nationsbacke inquiry have conclude that war crime have be commit by israel and by hama as well as other palestinian group during the now eightmonth conflict
aj_10,uncovering of mass grave at gazas nasser hospital what you need to know More than body retrieve from two of the large hospital in Gaza after israeli siege end this month the discovery of a mass grave inside the nasser medical complex in khan younis in the southern gaza strip this week have be meet with grief and horror from palestinians and have draw condemnation from the united nations and call for a transparent and credible investigation
aj_11,uk will not block arm sale to israel say foreign minister david cameron british government be come under grow pressure to halt weapon supply to Israel as it continue its war on Gaza the united kingdom will not halt arm sale to israel by british company after review the late legal advice on the matter foreign minister david cameron have say
aj_12,hamas fire rocket at israels tel aviv cause first siren for month the israeli army have say that eight rocket be fire from Gaza target central Israel include Tel Aviv hamas say it have launch rocket at tel aviv prompt siren to sound in the israeli city for the first time in several month
aj_13,pakistani activist heckle german ambassador over gaza Activists in Pakistan call out the german ambassador allege hypocrisy for speak at a human right forum while Germany stifle criticism of Israels assault on Gaza the propalestinian demonstrator be quickly remove from the Asma Jahangir Conference by authority
aj_14,how israel push dot red line to have its way in rafah Israel have ignore call from its western ally not to conduct a major operation in Rafah and face no consequence israeli tank have roll into rafah city centre and its army announce that it now control the entire philadelphi corridor the strip of land that run along egypt border with gazas rafah governorate
aj_15,hezbollah say will keep fight if israel press on with assault on gaza Hezbollah chief Nasrallah say support for Gaza be final as crossborder fighting displace thousand of people the head of powerful lebanese armed group hezbollah say that resident of northern israel would not be able to return home for the start of the next school year if their government press on with its assault on the gaza strip
aj_16,gaza ceasefire talk end in cairo with no substantial answer or solution Hamas say negotiation to continue next week even as Israel thwart deal to secure truce before Ramadan hamas say its delegation have leave egypt but talk on a ceasefire in the gaza strip will continue next week until an agreement be reach with israel whom the palestinian group say have thwart mediator attempt to broker a deal before the muslim holy month of ramadan
aj_17,timeline the biden administration on gaza in its own word Al Jazeera look at washington main statement and position on Israels war in Gaza and how policy shift over time washington dc as israel war in gaza prompt mount human right concern the united states have slowly notch up criticism of the israeli government while simultaneously continue to arm and support its ally
aj_18,what happen when israel attack rafah Israel have attack twice since Sunday kill ten of people in horrific circumstance thirteen out of people kill by israel in an air strike on the socalled safe area of almawasi be civilian woman and girl al jazeeras hind khoudary report on tuesday
aj_19,israel attack unrun school in central gaza kill at least Government spokesman say AlAqsa Hospital at three time its clinical capacity as dead and wound continue to arrive an israeli air attack on a unrun school shelter displace palestinians in central gazas nuseirat camp kill at least people mainly woman and child accord to local government official
aj_20,silence the gun say un chief in speech mark month of war on gaza Israels military campaign have bring relentless death and destruction for people in Palestine say UN Secretary General Antonio Guterres in a speech mark six month of war in Gaza Guterres say nothing can justify the collective punishment take place there
aj_21,israel war on gaza list of key event day two mass grave be discover in Gaza on Monday one at alShifa Hospital and the second in Beit Lahiya here how thing stand on tuesday april
aj_22,we set to impose sanction on israeli military unit over abuse report israeli prime minister say he will fight any sanction target israeli military unit for allege right violation israeli prime minister benjamin netanyahu have say he would fight against any sanction be impose on israeli military unit for allege right violation after a united states media outlet report that washington be plan such a step
aj_23,al jazeera journalist free after arrest by israeli force in gaza Media watchdog decry Ismail alGhouls arrest from alShifa Hospital where thousand of civilian be trap al jazeera arabic correspondent ismail alghoul have be release after be arrest for hour and severely beat by israeli force in gaza citys alshifa hospital
aj_24,the theatric of genocidal impunity Germany and the US be render a draft resolution on the bosnian genocide meaningless with their position on Gaza on may a draft resolution be submit to the united nations general assembly unga to declare july a day of remembrance for the srebrenica genocide the document be put forward by germany and rwanda and cosponsor by the united states and other country it will be debate and vote on during a unga session on may
aj_25,israeli military spokesman hamas defeat remark widen rift with netanyahu Daniel Hagari go against Netanyahu by say that identify the impossible task of defeat Hamas as Israels end goal in Gaza mean throw sand in people eye al jazeera be report from outside israel because it have be ban by the israeli government
aj_26,un report on israel hamas murder starvation genderbase violence the israeli government and palestinian group include Hamas have commit war crime during the war on Gaza accord to a report from the UN Commission of Inquiry it detail a long list of offence include the use of extermination starvation indiscriminate attack siege warfare and sexual and other genderbased violence
aj_27,we and uk air strike hit yemen houthirun tv report Attacks target Hodeidahs airport and region north of Sanaa Al Masirah TV say as Houthis continue Red Sea attack the united states and united kingdom have carry out six air strike against target in yemen a houthirun television station report as the yemeni group target ship lane in the red sea
aj_28,palestinian girl rescue from rubble after israeli attack in gaza Video show the rescue of palestinian girl who d been trap under rubble after an israeli attack in Gaza as she be free from the debris the child be see ask for her mother who die in the attack accord to witness
aj_29,photo palestinians in gaza prepare for eid amid death and destruction Israels assault on the Gaza Strip have place a pall over Eid celebration for Palestinians this year the shadow of continued israeli attack on the gaza strip loom large over palestinians as they prepare for the muslim holiday of eid alfitr mark the end of the fast month of ramadan
aj_30,israel war on gaza list of key event day as the world celebrate International Womens Day Gazas Health Ministry provide an update on the challenge face woman in the Gaza Strip here how thing stand on friday march
aj_31,they would have to kill I first a symbol of coexistence no more on march ayman shaer find himself lie on the ground in the ancient square of sebastia bleeding and in unbearable pain
aj_32,hundred of student arrest in us gaza war protest scuffle at ucla Police out in full force some use chemical irritant and taser to disperse student as more university join movement hundred of student have be arrest across university in the united states with scuffle report between proisraeli and propalestinian demonstrator at ucla as rally for a ceasefire in gaza and divestment from company link to israel spread across we campus
aj_33,how gazas child be prepare for israel invasion of rafah I close up as an israeli ground assault on Gazas last safe zone loom two child in Rafah brace for it we be afraid people will resort to kill each other for food husam say as he recount his daily battle to secure basic necessity like food water and sanitation in rafah during the israelhamas war
aj_34,uk australia call for immediate end to fighting in gaza two country warn of potentially devastating consequence if Israel push ahead with ground offensive in Rafah australia and the united kingdom have call for an immediate cessation of fighting in gaza warn of potentially devastating consequence if israel go ahead with a plan ground assault on the southern city of rafah
aj_35,israel war on gaza update un overwhelmingly vote for palestine right Resolution call on UN Security Council to favourably reconsider Palestines request to become the member of the United Nations this live page be now close you can continue to follow our coverage of the war in gaza here
aj_36,world react to unsc resolution demand gaza ceasefire many official around the world have welcome the resolution many world leader have welcome a united nations security council unsc resolution that demand an immediate ceasefire between israel and the palestinian group hamas in gaza
aj_37,oxfam accuse israel of deliberately block aid to faminestalke gaza Aid truck be wait an average of day to access the enclave the NGO say as warning of impending famine rise israel be use bureaucracy to deliberately hinder aid supply head into gaza oxfam have claim
aj_38,remember palestinian journalist amna homaid israeli Channel air her photo claim she be a terrorist a few week later an israeli missile kill she and her son on april amna homaids tear body lie in the rubble of a house in shati camp in the western part of gaza city as rescuer try to find survivor an israeli attack have strike the building kill she and her eld son mahdi her brother and her other five child be injure but survive
aj_39,police arrest antiwar student protester at texas university US riot police have be film arrest a person who appear to be disabled during antiwar protest at the University of Texas Dozens of student be arrest as police move in to clear the encampment reportedly use pepper spray to disperse crowd
aj_40,biden consider arm transfer to israel include jet report Biden face pressure from foreign partner right group and some fellow Democrats in Congress to impose condition on arm transfer to Israel us president joe bidens administration be weigh whether to go ahead with an arm transfer package to israel that would include dozen of aircraft accord to the reuters news agency
aj_41,yemen houthis launch attack on we israeli vessel as warship defend new attack come two week after Iranaligned group say it target three vessel and a US warship yemen iranaligned houthi armed group say it attack we and israeli vessel with a western coalition of warship defend amid the continue fallout from the war on gaza
aj_42,gaza emergency health chief kill in israeli air attack an israeli air attack on a Gaza City clinic kill two people include the director of Gazas ambulance and emergency department Hani alJaafrawi the enclave Health Ministry say at least medical staff have be kill in Gaza since October
aj_43,human shielding in action israeli force strap palestinian man to jeep israeli force tie wound palestinian man to a military jeep in an incident a UN expert say amount to use he as a human shield israeli force in the occupied west bank have tie a wound palestinian man to the hood of a military vehicle during a raid on the city of jenin appear to use he as a human shield
aj_44,un expert accuse israel of genocide in gaza Francesca Albanese say there be clear indication that Israel have violate three of five act list under UN Genocide Convention there be reasonable ground to believe israel be commit genocide in the besiege palestinian enclave of the gaza strip accord to a report issue by a united nationsappointe expert
aj_45,the goal be to destroy gaza why israel reject a ceasefire with hamas Israel have reject a ceasefire and launch an operation in Rafah raise fear that the war in Gaza could drag on israel appear to have be blindside by hamass announcement on monday that it have agree to an egyptianqatari ceasefire proposal but the israeli government quickly make its position clear the proposal be not something it would agree to and to make matter more explicit its military force take control of the palestinian side of egypt border with gaza in rafah
aj_46,israel expand gaza offensive as mediator ceasefire bid continue heavy israeli air raid kill dozen in central Gaza as US Qatari and egyptian mediator plan to resume talk dozen of palestinians have be kill in heavy israeli bombardment of the central gaza strip as we qatari and egyptian mediator plan to resume talk on a propose ceasefire and captive release deal
aj_47,united nations general assembly back palestinian bid for membership Resolution do not give Palestine full UN membership but recognise it as qualified to join and extend new right and privilege the united nations general assembly unga have back a palestinian bid to become a full un member by recognise it as qualified to join and recommend the un security council reconsider the matter favourably
aj_48,israel claim senior hamas commander marwan issa kill in gaza strike no immediate confirmation from Hamas after israeli military spokesman say Issa be kill in a strike two week ago israel military spokesman say hamas deputy military commander marwan issa be kill early this month in an israeli attack on the gaza strip
aj_49,palestinian who be shoot and tie to israeli army vehicle describe ordeal they be laugh and play the palestinian man who be shoot then tie to the front of an israeli army vehicle and drive around have be describe his treatment by soldier in the occupy West Bank
aj_50,israel war on gaza update hamas studies proposal in positive spirit Hamas say a delegation be set to visit Egypt soon for further ceasefire talk this live page be now close you can continue to follow our coverage of the war in gaza here
aj_51,palestinians mark last day of ramadan on the eve of six month of war as the muslim fast month draw to a close next week many Palestinians spend their day in prayer amid Israels war palestinian muslim be mark a tense and sombre last weekend in ramadan as israel war on gaza approach the sixmonth mark
aj_52,israeli minister order return of equipment seize from ap news agency the Associated Press news agency welcome decision to return equipment raise concern about the israeli government use of the new foreign broadcaster law israel communication minister have order that a camera and broadcasting equipment seize from the associated press ap news agency in southern israel should be return
aj_53,spain formally recognise palestine as a state Spain have formally recognise Palestine as a state in a historic move towards justice and the only route to achieve peace accord to Prime Minister Pedro Sanchez Spain join Ireland Norway and other country to acknowledge palestinian statehood
aj_54,israel seize hectare of palestinian land in occupy west bank Finance Minister Bezalel Smotrichs announcement come despite international pressure against Israels building of illegal settlement israel finance minister bezalel smotrich have declare hectare acre in the occupied west bank as state land in a move that will facilitate the use of the ground for settlement building
aj_55,doctor make appeal to un to stop the suffering in gaza a panel of doctor speak out at the UN about the horror and suffer they see Palestinians face in Gaza as Israels onslaught and blockade continue to make the healthcare system unviable
aj_56,the app help people boycott brand support israel a new app in the US be help people to boycott business deem to be support Israel and its war on Gaza
aj_57,gaza war israel benjamin netanyahu to address us congress on july Congresss invitation late show of US support for Israel despite global outrage over Israels war on Gaza israeli prime minister benjamin netanyahu will address a joint meeting of the united states congress on july accord to top we lawmaker
aj_58,israeli force kill three palestinians in raid on west bank jenin at least other be wound by israeli force during an incursion into Jenin refugee camp local official say israeli force have kill at least three palestinians during a raid in the jenin refugee camp in the occupy west bank the palestinian health ministry have say as israel intensify its deadly attack in the territory
aj_59,israel war on gaza updates gaza govt say child at risk of die Lack of aid include food and vaccine have put thousand of child at risk of death Government Media Office say this live page be now close you can continue to follow our coverage of the war in gaza here
aj_60,displace palestinian cook maqlouba during wartime for his family before Ramadan fast begin displace Palestinian Abu Elias show we how he prepare the famous palestinian dish maqlouba for his family despite the shortage cause by Israels war on Gaza
aj_61,why be the us set up temporary port off gaza for aid delivery the pier which could take day to build might not be an effective solution to the urgent aid crisis in Gaza president joe biden have say the united states will set up a temporary pier off gaza to deliver humanitarian supply to the besiege enclave as palestinians begin to starve during israel blockade of the strip
aj_62,israeli force accuse of new massacre of people wait for gaza aid witness say israeli helicopter and tank open fire on crowd of desperately hungry people wait for aid in north Gaza where israeli force have repeatedly be accuse of attack aid seeker
aj_63,israel war on gaza list of key event day global outrage and pressure on Israel follow an attack that kill seven World Central Kitchen worker in Gaza this week here how thing stand on wednesday april
aj_64,world can not afford lebanon become another gaza un chief Antonio Guterres issue a stark warning as fullscale war between Lebanons Hezbollah and Israels army reach the brink united nations secretarygeneral antonio guterre express increase concern over the escalate war of word and deadly border clash between israel military and lebanon hezbollah fighter
aj_65,will israels war on gaza sway south africas election Governing ANC be vocally propalestine while main opposition da remain neutral on the Gaza war which may affect voter on May cape town south africa we can not allow supporter of baby killer to talk to we a furious resident of surrey estate in cape town shout as he heckle the speaker at the podium
aj_66,in gaza baby have no more nappy milk as israeli bombing continue a shortage of nappy because of Israels blockade have lead to price skyrocket and mother look for alternative deir elbalah gaza on a cold night three week ago aida albaawi rush from the makeshift tent she have make home to the town nearby alaqsa martyrs hospital and amid the ongoing war give birth to her daughter
aj_67,un security council meet after iran launch attack on israel its time to step back from the brink UN Secretary General Antonio Guterres tell the UN Security Council meeting on Sunday Guterres say the member state have a share responsibility to work for peace and prevent further escalation of hostility
aj_68,biden administration plan to send in military aid to israel report Request for tank ammunition tactical vehicle for Israel despite Bidens early pause on bomb over Rafah assault the biden administration have tell congress that it plan to send a package of military aid to israel accord to medium report despite the united statess opposition to a fullscale invasion of rafah in southern gaza and concern about rise civilian death
aj_69,footballer el ghazi promise to continue fight for palestinians month after have his contract terminate by german football club Mainz over his social medium post on Israels war on Gaza dutch player Anwar El Ghazi have release a video say he will continue to support Palestinians
aj_70,who chief warn the future of a generation in peril as gaza famine loom who chief Tedros say child in Gaza be die of malnutrition and urge Israel to facilitate the entry of more aid the head of the world health organization who have say that only the expansion of land crossing for aid delivery into gaza could help prevent famine in the densely populate palestinian enclave
aj_71,will joe biden do more to stop israel assault on rafah in a rare warning the US president threaten to halt some arm supply if Israel invade city in southern Gaza for the first time since israel war on gaza begin in october united states president joe biden have admit american weapon have be use to kill civilian
aj_72,ten of thousand of israelis rally against pm netanyahu in jerusalem Israelis throng central Jerusalem in the large protest since Israels war on Gaza break out in October ten of thousand of israelis have march in jerusalem call for increase effort to free captive hold in gaza and the removal of prime minister benjamin netanyahu
aj_73,netanyahu slam we for withhold weapon to israel israeli PM say the US promise to work to remove restriction but Washington say bomb shipment still under review israeli prime minister benjamin netanyahu have criticise the administration of us president joe biden for withhold weapon to israel in recent month as it press its war on gaza
aj_74,the max planck society must end its unconditional support for israel an open letter by employee call on the MPS to reconsider its stance on Israel in view of israeli genocidal action we a diverse group of employee at the max planck society mps germanys top research institution be write this letter to express our disapproval of the position our employer have take on israelpalestine and call for a serious change in discourse both within the mp and in germany as a whole about israelpalestine
aj_75,what will the future bring between hezbollah and israel analyst believe an escalation be imminent but view vary on how thing will go beirut lebanon israel decision to withdraw the majority of its troop from gaza at least temporarily have analyst in lebanon anticipate an intensification of some sort against lebanon hezbollah to israel north
aj_76,israel war on gaza updates ground force invade bureij refugee camp Deadly air strike and artillery fire on Hamas target in Bureij refugee camp as israeli ground troop storm the central Gaza region this live page be now close you can continue to follow our coverage of the war in gaza here
aj_77,israel can not win gaza war without dayafter plan blinken warn Top US diplomat say that without a strategy to govern and stablise Gaza Hamas or something bad will reemerge after war the united states have once again issue a strong warning to israel over its lack of a postwar strategy for gaza leave open question about how the territory will be govern and stablise
aj_78,wfps matthew hollingworth on gaza famine mean failure the World Food Programmes Palestine director on urgent aid in Gaza where trap civilian struggle amid a collapse infrastructure the human cost of israel ongoing war on gaza be become increasingly evident
