id,document
aj_390,what have allow israel operate an assassination policy for decade Sons and grandchild of Hamas political leader kill in late israeli air attack in Gaza three son and four grandchild of hamas political leader ismail haniyeh be assassinate in gaza on wednesday
aj_391,video show kamala harris heckle over gaza during jimmy kimmel talk show Activists in the US disrupt Vice President Kamala Harriss interview on Jimmy Kimmel Live over her stance on Israels war on Gaza the activist be forcibly remove by security guard before a man who claim to be a police officer say they be under arrest
aj_392,israels netanyahu dissolve the war cabinet do it matter israeli Prime Minister Benjamin Netanyahu have dissolve his war cabinet after be pressure to add member israel prime minister benjamin netanyahu have dissolve the countrys war cabinet follow the withdrawal of his principal rival benny gantz
aj_393,do ceasefire in gaza mean israeli escalation with lebanon hezbollah War drum beat louder as Israel kill Hezbollah commander and lebanese group launch massive missile attack beirut lebanon hezbollah fire more than missile and rocket across its southern border on wednesday in one of its heavy attack on northern israel since the war
aj_394,extent of force hunger crisis in gaza reveal in un report four child have starve to death this week in Gaza where a new UN report have reveal the extent of the force hunger crisis impose by Israel in its ongoing war
aj_395,israeli military say people kill in gazas alshifa hospital raid as siege on medical complex enter its third day survivor recount harsh detention humiliation and abuse the israeli military say it have kill people during its raid on gazas alshifa hospital where a siege have enter a third day as displace palestinians shelter in the facility describe long detention and abuse
aj_396,spain say to join south africas gaza genocide case against israel at icj the case accuse Israel of violate its obligation under the Genocide Convention in its war on Gaza spain say it will join the case file by south africa at the international court of justice icj which accuse israel of violate its obligation under the genocide convention in its war on the gaza strip
aj_397,what do texan red heifer have to do with alaqsa and a jewish temple Temple Movements plan to sacrifice the cattle see as a step towards its goal of build the Third Temple over AlAqsa Mosque they have come from halfway across the world and be keep under tight security and raise accord to the strictest rule
aj_398,no life here israel army withdraw from gazas alshifa hospital witness say hundred of body be find inside alShifa Medical Complex and outside in the surround street israel have withdraw its force from gazas alshifa hospital follow a twoweek operation leave behind scene of devastation
aj_399,before israel war on gaza other time we campus become battleground Students from Columbia and other US university have protest against the Vietnam war the Gulf war and racism in the past from coast to coast university student in the united states be protest against israel war on gaza despite threat of suspension and arrest
aj_400,ireland spain norway move close to recognise a palestinian state spanish pm Pedro Sanchez say declaration on Palestine will be make when the condition be appropriate ireland and norway be both move close to recognise palestinian statehood leader of the two country express separately after meeting with spain prime minister pedro sanchez who also champion the move
aj_401,israel pound north gaza after attack on southern almawasi safe zone International Committee of the Red Cross say heavycalibre projectile land metre from its office in the designate safe zone in the south the israeli military have launch attack across the gaza strip after an assault on a tent camp in almawasi in the south kill at least people accord to palestinian official
aj_402,baby girl rescue from mother womb die the premature baby girl who be rescue from her mother womb after an israeli air strike on their home in Rafah have die the baby name Sabreen alrouh Jouda be rescue Saturday after the strike that kill her mother father and young sister she die Thursday in hospital and be bury next to her family
aj_403,uk university student join propalestine protest Students in the UK include those at Cambridge and Oxford be show solidarity with Palestine and their peer around the world similar to protest in the US Canada and France encampment be set up on campus with student demand a boycott and divestment from Israel
aj_404,israel war on gaza updates rafah hospital close due to israeli bomb one of city two hospital shut down after israeli attack kill two medical staff one day after tent camp massacre this live page be now close you can continue to follow our coverage of the war in gaza here
aj_405,ten of thousand take part in antigovernment protest in israel Protesters say Jerusalem rally be the big antigovernment protest since Israel launch its war on Gaza in October ten of thousand of people have gather outside the israeli parliament building in jerusalem in the large antigovernment protest since israel launch its assault on gaza
aj_406,the take will israel protest change netanyahus calculus Jerusalem see the large gathering of antigovernment protester in Israel since Oct
aj_407,israel war on gaza update hamas say review new israeli proposal Official Khalil alHayya give no detail of offer as israeli FM say Rafah invasion to be suspend if deal reach this live page be now close you can continue to follow our coverage of the war in gaza here
aj_408,gaza war how biden adopt call for ceasefire without shift policy the US say it be seek a ceasefire for a limited time but palestinian right advocate want a lasting end to Israels war washington dc cheer erupt when united states vice president kamala harris call for an immediate ceasefire in gaza early this month
aj_409,not even the us government know the us government line on rafah and as conflicting chatter carry on in Washington Israel keep on kill in an interview on sunday with nbc news united states secretary of state antony blinken be question about president joe biden recent threat to withhold offensive weaponry from israel in the event of an allout assault on rafah the city in the southern gaza strip where more than palestinians be shelter
aj_410,hamas israel say no progress in gaza truce talk no major progress achieve in negotiation in Cairo Israeli and Hamas official say israeli and hamas official say no significant progress have be make in the late round of gaza truce talk in cairo attend by representative from mediator egypt qatar and the united states
aj_411,revisit molokhia amid war and displacement in gaza Address Tent azzawayda gaza a year ago siham abu shaaban make molokhia for fork the system explain how it be consider a lucky charm of a dish that many family have to have on their ramadan table
aj_412,significant part of gaza face faminelike condition who say World Health Organization chief Tedros say child under age five in Gaza have be diagnose with acute malnutrition thousand of palestinian child in gaza have be diagnose with malnutrition the world health organization who have say as israel continue to severely restrict supply of food water medicine and fuel to the territory
aj_413,how do we intelligence disagree with israel on gaza Spy agency say Hamas and its tunnel network will not be destroy in its annual threat report the united states intelligence community have conclude that hamas can not be destroy
aj_414,slovenias moral duty what be behind its push to recognise palestine as Israels war rage in Gaza Slovenia be join a clutch of european nation that hope to pave a pathway to peace slovenia be set to recognise palestinian statehood in june follow in the footstep of ireland norway and spain
aj_415,israel war on gaza updates un chief say middle east on the brink iranian official warn Israel of a large attack should it respond to overnight drone and missile assault this page be now closed follow the late update here
aj_416,un report israeli strike systematically violate law of war mean and method of warfare to minimise civilian casualty appear to have be consistently violate a report from the UN Office of Human Rights find a pattern of indiscriminate and disproportionate israeli strike harm civilian in Gaza
aj_417,former trump official call gazas waterfront property very valuable Jared Kushner former senior foreign policy adviser to Donald Trump have say waterfront property in Gaza could be very valuable and that Israel should move Palestinians out of Gaza to enable an attack on Rafah
aj_418,un security council do not pass draft we resolution on gaza ceasefire Russia and China veto US proposal that critic say fall short of demand an end to Israels war on Gaza the united nations security council have fail to pass a united states draft resolution call for but not demand a ceasefire in israel continue war on gaza after two permanent member choose to veto it
aj_419,south africa seek third intervention against israel at icj stop the carnage South Africa tell the ICJ in their third attempt to seek provision against Israel in its war on Gaza at today hear the uns top court be tell an end to the hostility be a matter of extreme urgency and that Israels action clearly indicate genocidal intent
aj_420,biden israel netanyahu make mistake on gaza in strong criticism yet Biden take issue with Israels approach but not its devastating war on Gaza united states president joe biden have say israeli prime minister benjamin netanyahu be make a mistake in his handling of the gaza war and its repercussion inside israel and internationally
aj_421,phone tap and intimidation israel war against the icc israeli official be accuse of use phone tap spying and intimidation against ICC prosecutor to derail possible war crime investigation its a decade long operation against the world court as Al Jazeeras Soraya Lennie explain
aj_422,world react to israel rafah evacuation order UN agency aid group warn of devastating consequence of any military assault on Rafah after Israel order ten of thousand to evacuate city in southern Gaza the israeli army have order ten of thousand of palestinians to leave rafah amid grow fear of a ground assault on the southern gaza city where million people displace by israel war on gaza have seek shelter
aj_423,we lawmaker slam icc prosecutor israel arrest warrant request republican legislator threaten consequence against International Criminal Court official include travel ban lawmaker in the united states have slam the international criminal court iccs decision to seek arrest warrant for senior israeli official accuse of war crime in gaza with some republicans threaten to impose consequence against the international tribunal
aj_424,israeli air raid kill dozen across the gaza strip at least Palestinians have be kill by Israel since October with kill in the last hour israel have continue its aerial and ground bombardment of the gaza strip kill dozen more palestinians as fight rage around gaza citys main alshifa hospital palestinian official and the israeli military say
aj_425,palestinian employee of german development agency abuse in israeli jail Baraa Odeh have tell her lawyer from prison that she have be repeatedly stripsearche and physically assault berlin germany a palestinian employee of germanys statefunde development agency have be imprison in israel for more than a month where she have be beat and subject to abusive and humiliating treatment her family member and lawyer say
aj_426,the battleground be palestine israels war loom over european election EU insider and voter say many will be back party that be supportive of Gaza brussels belgium election for the european parliament traditionally focus on issue such as the cost of live farm policy climate change and the european unions migration policy
aj_427,israel war on gaza update israel say hamas chief kill on march Announcement that Hamas number three Marwan Issa be kill March come just a day after uns Gaza ceasefire call the live page be now close you can continue to follow our coverage of the war in gaza here
aj_428,letter from kibbutz israel in these dark time it be hearten to see the palestinian cause conquer new terrain in Washington and beyond in the wee hour of may police officer in washington dc violently clear the propalestine encampment at george washington university gw with the help of pepper spray arrest people university president ellen granberg have call the cop on what she claim be an unlawful oncampus expression of solidarity with the victim of israel current genocide in the gaza strip which have officially kill some people in less than eight month although this number be no doubt a grave underestimate
aj_429,us university tie to weapon contractor under scrutiny amid war in gaza Activists be call attention to historical tie between university and defence contractor link to Israels war los angeles california as the war in gaza enter its eighth month israel military campaign one of the most destructive in modern history have kill nearly palestinians most of they woman and child
aj_430,palestinian journalist attack by rightwe jerusalem day marcher Thousands of ultranationalist Israelis parade through occupy East Jerusalem as part of an annual Jerusalem Day flag march Video show they antagonise palestinian and arab local and attack palestinian journalist Saif Kwasmi
aj_431,do israel twist humanitarian law to justify gaza carnage UN Special Rapporteur Francesca Albanese explain how Israel justify its killing and mass destruction in Gaza to the united nations official task with reporting on palestinian human right international law be clear israel should withdraw from the territory it occupy in
aj_432,do israel intentionally target a world central kitchen convoy in gaza World Central Kitchen be know for feed people around the world why do Israel open fire on its worker
aj_433,disastrous israeliran tension test limit of us policy amid gaza war Bidens ironclad backing of Israel be come into conflict with the USs state goal of avert regional war analyst say washington dc united states president joe biden have a brief but stern warning for iran as it promise to retaliate against israel for a deadly air raid on its consulate in damascus do not
aj_434,israels knesset advance contentious ultraorthodox conscription law farright religious party be back the bill with a view to insert change and limit conscription the israeli knesset have vote to revive a bill that would end exemption on military conscription for some ultraorthodox religious student
aj_435,israel war on gaza update one dead as settler rampage in west bank Man shoot to death in the occupy West Bank town of alMughayyir during one of settler attack on Palestinians this live page be now close please follow the late update here
aj_436,palestinians mark year of nakba as new tragedy unfold in gaza the Nakba be at the core of the palestinian struggle but in many way pale in comparison to Israels war on Gaza palestinians will mark the anniversary of their mass expulsion from what be now israel an event that be at the core of their national struggle but in many way that experience pale in comparison to the calamity now unfold in gaza
aj_437,biden deliver address at morehouse college amid anger over gaza war the historically black college be one of several US university to hold protest demand an end to the killing in Gaza joe biden have seek to address anger on united states university campuse over his support for israel amid the war in gaza as the us president deliver a graduation speech at a historically black college attend by martin luther king jr
aj_438,do israel need to be force by the us to end the war in gaza palestinian politician Mustafa Barghouti and US professor Ian Lustick dissect Bidens refusal to end the war in Gaza all of israel modern war have end with we intervention but the current war in gaza have go on for half a year because biden be a slow learner argue university of pennsylvania political scientist ian lustick
aj_439,israel war on gaza update deadly attack on palestinians await aid at least eight people kill in an israeli attack in Bani Suheila as desperate Palestinians gather for aid dispersal this live page be now closed
aj_440,will israel accept the new un gaza ceasefire resolution while Hamas welcome the ceasefire resolution pass in UNSC Israel seem determined to continue the war in Gaza the united nations security council unsc endorse a united statesbacked ceasefire resolution on monday in the late diplomatic effort to end eight month of israel devastate military offensive in the gaza strip
aj_441,hamas video of gaza captive hersh goldbergpolin trigger israel protest the israeli american criticise israeli pm Netanyahu in the undated threeminute clip hamas have release a video of an israeliamerican man hold captive in the gaza strip for the duration of israel war on the enclave ignite new protest call on the israeli government to do more to secure the captive release
aj_442,gazas jabalia and beit hanoon declare disaster area Israels military have destroy some housing unit and bulldoze drainage network and road in northern Gaza palestinian municipal authority have declare the city of jabalia and beit hanoon in the northern gaza strip disaster area
aj_443,when it come to israelpalestine true naivety be believe in endless war it be not naive to know that the only route to justice and equality be peace we be an israeli and a palestinian who forge an unlikely friendship when the world expect we to hate each other
aj_444,israel war on gaza list of key event day Twothirds of Gazas hospital be nonfunctional accord to the UN here how thing stand on thursday march
aj_445,rafah resident face further danger as israel hit city two hospital israeli air raid put Kuwaiti Hospital out of service and trap medical staff and patient inside indonesian Field Hospital the gaza strip collapse health system be under further strain after the israeli army intensify bombing in rafah tal assultan area and other part of the enclave a day after an attack on a camp in rafah kill palestinians
aj_446,unsc to vote on new gaza ceasefire draft as israel besiege three hospital United Nations chief say grow consensus emerge in international community to tell Israel a ceasefire be need the israeli military have besiege three hospital in gaza with medical team under heavy gunfire as a divided united nations security council be set to vote on a new draft resolution call for an immediate ceasefire in the enclave
aj_447,israeli strike kill clearly identifiable reporter in lebanon un probe UNIFIL investigation find israeli tank kill Reuters reporter Issam Abdallah and wound several other in October an israeli tank kill reuters reporter issam abdallah in lebanon last year by fire two round at a group of clearly identifiable journalist in violation of international law a united nations investigation into the october incident have find
aj_448,columbia suspend student after deadline to end gaza camp pass the number of arrest have cross since New York police detain first demonstrator at Columbia on April columbia university have begin suspend student demonstrator after they defy an ultimatum to disperse
aj_449,israel attack rafah at night all the people burn pained cry of the injure frantic effort by medic and unspeakable scene of the aftermath in Kuwaiti Hospital a little girl in pink pyjama have be settle on a bloody bed at kuwait specialty hospital in gazas southern city of rafah her face bewilder as she blink repeatedly
aj_450,watch the watchdog the us medium and intergenerational fault line the medium be play a central role in the clash between progressive youth and the political establishment in the US as israel continue to wage its genocidal war on gaza a fault line in american society be become increasingly more pronounced university student be challenge the political establishment on university campus across the country
aj_451,egypt elsisi reappoint pm madbouly order he to form new cabinet President say new government must tackle local and international issue egyptian president abdel fattah elsisi have reappointe prime minister mostafa madbouly to form a new government
aj_452,iran launch direct attack on israel watch the moment hundred of iranian missile and drone be launch at Israel with most intercept no death have be report Iran say it be retaliation for Israels attack on its Damascus consulate which kill iranian general
aj_453,why be israel force to change its song entry for eurovision the song contest pride itself on be nonpolitical but Israels inclusion threaten to overshadow the music this year for some it be the oscar for other it be rio carnival for many there be no annual event quite like eurovision the international singing contest extravaganza that attract million of viewer and feature everything from power ballad and punk rock to death metal and folk dancing
aj_454,police use tear gas on antiwar protester at florida university Police fire tear gas at protester who d set up a camp at the University of South Florida to condemn Israels war on Gaza several student be reportedly arrest as the camp be dismantle
aj_455,what have palestine activist in germany been face we look at the violence and intimidation that face those in Germany call for an end to Israels war on Gaza public shame in national newspaper arbitrary arrest and even beating by police these be just a few of the consequence that those protest for an end to israel war on gaza say they face in germany
aj_456,israel war on gaza list of key event day the israeli military say it be continue to conduct precise operation at alShifa Hospital here how thing stand on friday march
aj_457,israel war on gaza updates new mass grave find at alshifa hospital nine body find so far after doctor say they witness killing and burial by israeli force this live page be now close you can continue to follow our coverage of the war in gaza here
aj_458,not just the unrwa report countless account of israeli torture in gaza Al Jazeera speak to several release detainee about their ordeal in israeli hold facility though it have yet to respond to al jazeeras request for comment israel continue to push back against the accusation of torture level at its armed force in an unpublished report by the united nations relief and work agency for palestine refugee unrwa
aj_459,first friday prayer of ramadan in alaqsa despite israeli authority block thousand of Palestinians from reach the AlAqsa Mosque for first Friday prayer of Ramadan around worshipper be report to have make it to the holy site
aj_460,dozen of propalestinian protester arrest as columbia clear encampment New Yorkbased university move to suspend student involve as police arrest they for trespass more than propalestinian protester have be arrest on the campus of new yorks columbia university as police clear an encampment set up by student demonstrate against israel war in gaza
aj_461,like sri lanka once do israel have turn safe zone into kill field but there be one important difference between the two case the genocide in Gaza be not take place in the dark while our eye be on rafah block the small area in south gaza which the israeli military designate as a safe humanitarian zone on may but go on to bomb just four day later massacre at least civilian shelter in tent we be remind of a confidential cable intercept by wikileak describe the plight of civilian in the final day of the sri lankan civil war
aj_462,israel war on gaza update kill in israeli attack on rafah aid seeker our correspondent in Gaza say at least people injure in the attack which Reuters say be near an aid cross this live page be now close you can continue to follow our coverage of the war in gaza here
aj_463,palestinian paramedics fear gaza danger will spread to west bank after Israel kill more than medical worker in Gaza paramedic in the West Bank describe the threat they face hebron occupy west bank in his year as a paramedic jawdat almuhtaseb have work during fraught time from the second intifada to the heighten tension in and then to the current situation where the ripple effect of israel war on gaza lead to an increase in deadly israeli violence against palestinians in the occupy west bank
aj_464,qatar commit to israelhamas honest mediator role diplomatic source diplomatic source tell Al Jazeera that Qatar will not accept become a tool to pressure negotiate party qatar have stress that it will not accept become a tool to pressure any party and that it be committed to maintain its role as an honest mediator in its mediation between hamas and israel diplomatic source tell al jazeera arabic
aj_465,what be happen be not genocide say biden after icc warrant seek US President Joe Biden have defend Israel against the International Criminal Court prosecutor request for the court to issue warrant to arrest israeli and Hamas leader for alleged war crime
aj_466,norway spain ireland to recognise palestinian state we want to raise the voice of those who still believe in a peaceful nonviolent solution norwegian Foreign Minister Espen Barth Eide tell Al Jazeera the three european country will formalise their decision on May
aj_467,israel war on gaza update israel say troop move for new operation Israel say it pull out thousand of soldier include from warravaged Khan Younis ahead of other operation as truce talk in Cairo restart six month since the devastate conflict begin the live page be now close you can continue to follow our coverage of the war in gaza here
